{
  "schemaVersion":"1.0",
  "id":"pdd-board-shoes",
  "displayName":"拼多多童鞋板鞋上新助手",
  "version":"0.1.0",
  "status":"experimental",
  "adapter":{"id":"pdd.browser.cn.board-shoes","categoryKeys":["footwear.board-shoes"]},
  "dataNamespace":"pdd-board-shoes",
  "distributions":[
    {"target":"windows-x64","format":"portable-zip","status":"planned","buildCommand":null},
    {"target":"macos-universal","format":"portable-zip","status":"planned","buildCommand":null}
  ],
  "safety":{"humanReviewRequired":true,"automaticPublish":false}
}
